{
  "id": "concebolla",
  "name": "Tortilla con Cebolla",
  "description": "Spanish Tortilla with juicy caramelized onions.",
  "difficulty": "medium",
  "tags": ["traditional", "spanish", "vegetarian", "with-onion"],
  "hints": [
    "Fry onions until golden before mixing."
  ],
  "requirements": {
    "potatoes": {
      "entityId": "potato",
      "amount": 4,
      "unit": "pcs"
    },
    "eggs": {
      "entityId": "egg",
      "amount": 6,
      "unit": "pcs"
    },
    "oil": {
      "entityId": "oil",
      "amount": 100,
      "unit": "ml"
    },
    "onions": {
      "entityId": "onion",
      "amount": 1,
      "unit": "pcs"
    },
    "salt": {
      "entityId": "salt",
      "amount": 1,
      "unit": "tsp"
    },
    "black_pepper": {
      "entityId": "black_pepper",
      "amount": 1,
      "unit": "pinch"
    }
  },
  "cooklang": "Peel the @potatoes{4%pcs}.\nWash the @potatoes.\nSlice the @potatoes.\nPeel the @onions{1%pcs}.\nWash the @onions.\nDice the @onions.\nHeat the @oil{100%ml}.\nFry the @potatoes until tender.\nFry the @onions until golden.\nBeat the @eggs{6%pcs}.\nAdd @salt{1%tsp} and @pepper{1%pinch}.\nMix the fried potatoes and onions with the beaten eggs, salt and pepper.\nPour the mixture into the pan.\nCook for 5 minutes.\nWith a soft spatula, make sure the tortilla does not stick to the pan.\nFlip the tortilla.\nCook for another 5 minutes.\nServe the tortilla.\nCelebrate.",
  "steps": [
    {
      "action": "prepare",
      "target": "potatoes",
      "preparation": "peeled"
    },
    {
      "action": "wash",
      "target": "potatoes"
    },
    {
      "action": "prepare",
      "target": "potatoes",
      "preparation": "sliced"
    },
    {
      "action": "prepare",
      "target": "onions",
      "preparation": "peeled"
    },
    {
      "action": "wash",
      "target": "onions"
    },
    {
      "action": "prepare",
      "target": "onions",
      "preparation": "diced"
    },
    {
      "action": "cook",
      "target": "oil",
      "method": "heat"
    },
    {
      "action": "cook",
      "target": "potatoes",
      "method": "fry"
    },
    {
      "action": "cook",
      "target": "onions",
      "method": "fry",
      "containerId": "burner2"
    },
    {
      "action": "prepare",
      "target": "eggs",
      "preparation": "beaten"
    },
    {
      "action": "mix",
      "inputs": [
        "potatoes",
        "onions",
        "eggs",
        "salt",
        "black_pepper"
      ],
      "output": "mixture"
    },
    {
      "action": "cook",
      "target": "mixture",
      "method": "fry",
      "duration": 5,
      "unit": "min",
      "as": "Tortilla con cebolla"
    },
    {
      "action": "flip",
      "target": "mixture"
    },
    {
      "action": "serve",
      "target": "mixture",
      "as": "Tortilla con cebolla",
      "containerId": "plate"
    },
    {
      "action": "celebrate"
    }
  ]
}
